{"root":"bringen","lemma":"bringen.verb","en":"bring, take (somewhere)","pres3":"bringt","pret":"brachte","aux":"hat","pp":"gebracht","level":"A1","zipf":5.3,"stems":["bring","brach"],"boards":{"A2":{"words":["mitbringen.verb","verbringen.verb","zurückbringen.verb","beibringen.verb","wegbringen.verb","vorbeibringen.verb"],"light":["mitbringen.verb","verbringen.verb","zurückbringen.verb","beibringen.verb","wegbringen.verb","vorbeibringen.verb"],"tiles":{"pre":["mit","ver","zurück","bei","weg","vorbei","um"],"suf":[]},"distract":[{"pre":"um","is":"extra"}]},"B1":{"words":["mitbringen.verb","verbringen.verb","zurückbringen.verb","beibringen.verb","umbringen.verb","anbringen.verb","unterbringen.verb","wegbringen.verb","herausbringen.verb","zusammenbringen.verb"],"light":["mitbringen.verb","verbringen.verb","zurückbringen.verb","beibringen.verb","umbringen.verb","unterbringen.verb"],"tiles":{"pre":["mit","ver","zurück","bei","um","an","unter","weg","heraus","zusammen","ent"],"suf":[]},"distract":[{"pre":"ent","is":"none"}]},"B2":{"words":["unterbringen.verb","die_Unterbringung","vorbringen.verb","erbringen.verb","abbringen.verb","aufbringen.verb","aufgebracht.adj","sich_einbringen.verb","herausbringen.verb","weiterbringen.verb","anbringen.verb","beibringen.verb"],"light":["unterbringen.verb","vorbringen.verb","erbringen.verb","aufbringen.verb","sich_einbringen.verb","herausbringen.verb"],"tiles":{"pre":["unter","vor","er","ab","auf","ein","heraus","weiter","an","bei","miss","ent"],"suf":["ung","pp"]},"distract":[{"pre":"miss","is":"none"},{"pre":"ent","is":"none"}]}},"none":[{"key":"ent|","word":"entbringen","chk":{"dwds":false,"wf":0,"hits":0}},{"key":"miss|","word":"missbringen","chk":{"dwds":false,"wf":0,"hits":0}}],"rare":[],"reviewedBy":"model-2pass","reviewedAt":"2026-10-08","forms":[
 {"id":"bringen.verb","card":null,"word":"bringen","cls":"verb","aux":"hat","pp":"gebracht","parent":null,"pre":[],"suf":[],"key":"|","seg":[["r","bring"],["i","en"]],"stress":2,"en":"bring, take (somewhere)","ex":"Bringst du mir bitte ein Glas Wasser?","exEn":"Could you bring me a glass of water, please?","grade":"T","how":"lit","level":"A1","zipf":5.3,"board":false,"lemma":"bringen.verb","lex":["list","dwds","corpus","wf"]},
 {"id":"mitbringen.verb","card":"PF:mitbringen.verb","word":"mitbringen","cls":"verb","kind":"s","aux":"hat","pp":"mitgebracht","parent":"bringen.verb","add":"mit","side":"pre","pre":["mit"],"suf":[],"key":"mit|","seg":[["p","mit"],["r","bring"],["i","en"]],"stress":1,"en":"bring (along) with you","clue":"to bring along (to a party)","ex":"Soll ich zur Party einen Kuchen mitbringen?","exEn":"Shall I bring a cake to the party?","why":"mit = with: you bring it with you.","grade":"T","how":"lit","level":"A1","zipf":4.04,"board":true,"lemma":"mitbringen.verb","lex":["list","dwds","corpus","wf"]},
 {"id":"verbringen.verb","card":"PF:verbringen.verb","word":"verbringen","cls":"verb","kind":"i","aux":"hat","pp":"verbracht","parent":"bringen.verb","add":"ver","side":"pre","pre":["ver"],"suf":[],"key":"ver|","seg":[["p","ver"],["r","bring"],["i","en"]],"stress":5,"en":"spend (time)","clue":"to spend (time, a holiday)","ex":"Wir verbringen den Sommer am Meer.","exEn":"We're spending the summer by the sea.","why":"ver- = away, used up: you bring the time along until it is gone.","grade":"M","how":"pic","level":"A2","zipf":4.42,"board":true,"lemma":"verbringen.verb","lex":["list","dwds","corpus","wf"]},
 {"id":"sich_einbringen.verb","card":"PF:sich_einbringen.verb","word":"einbringen","cls":"verb","kind":"s","refl":true,"aux":"hat","pp":"eingebracht","parent":"bringen.verb","add":"ein","side":"pre","pre":["ein"],"suf":[],"key":"ein|","seg":[["p","ein"],["r","bring"],["i","en"]],"stress":0,"en":"sich einbringen: get involved, contribute; einbringen: bring in (money, a harvest), table (a bill)","clue":"to get involved (sich; in a team)","ex":"Jeder kann sich mit Ideen einbringen.","exEn":"Everyone can contribute ideas.","why":"ein = in: you bring yourself into a group.","grade":"M","how":"pic","level":"C1","zipf":3.9,"board":true,"lemma":"sich_einbringen.verb","lex":["list","dwds","corpus","wf"]},
 {"id":"beibringen.verb","card":"PF:beibringen.verb","word":"beibringen","cls":"verb","kind":"s","aux":"hat","pp":"beigebracht","parent":"bringen.verb","add":"bei","side":"pre","pre":["bei"],"suf":[],"key":"bei|","seg":[["p","bei"],["r","bring"],["i","en"]],"stress":1,"en":"teach (someone something)","clue":"to teach (someone a skill)","ex":"Mein Vater hat mir das Schwimmen beigebracht.","exEn":"My father taught me to swim.","why":"bei = with, beside: you bring a skill to someone's side.","grade":"M","how":"pic","level":"B1","zipf":3.75,"board":true,"lemma":null,"lex":["dwds","corpus","wf"]},
 {"id":"umbringen.verb","card":"PF:umbringen.verb","word":"umbringen","cls":"verb","kind":"s","aux":"hat","pp":"umgebracht","parent":"bringen.verb","add":"um","side":"pre","pre":["um"],"suf":[],"key":"um|","seg":[["p","um"],["r","bring"],["i","en"]],"stress":0,"en":"kill, murder","clue":"to kill (someone)","ex":"Im Film bringt der Gärtner den Chef um.","exEn":"In the film the gardener kills the boss.","why":"Learn it as a word: um- does not give the meaning here; it simply means to kill.","grade":"O","how":"word","level":"B1","zipf":3.9,"board":true,"lemma":null,"lex":["dwds","corpus","wf"]},
 {"id":"anbringen.verb","card":"PF:anbringen.verb","word":"anbringen","cls":"verb","kind":"s","aux":"hat","pp":"angebracht","parent":"bringen.verb","add":"an","side":"pre","pre":["an"],"suf":[],"key":"an|","seg":[["p","an"],["r","bring"],["i","en"]],"stress":0,"en":"attach, fit, mount (on a wall)","clue":"to fix, to mount (on a wall)","ex":"Wir bringen das Regal an der Wand an.","exEn":"We're putting the shelf up on the wall.","why":"an = on, at: you bring a thing onto a surface.","grade":"T","how":"lit","level":"B2","zipf":3.63,"board":true,"lemma":null,"lex":["dwds","corpus","wf"]},
 {"id":"unterbringen.verb","card":"PF:unterbringen.verb","word":"unterbringen","cls":"verb","kind":"s","aux":"hat","pp":"untergebracht","parent":"bringen.verb","add":"unter","side":"pre","pre":["unter"],"suf":[],"key":"unter|","seg":[["p","unter"],["r","bring"],["i","en"]],"stress":0,"en":"accommodate, put up (guests); find room for","clue":"to put up (guests for the night)","ex":"Wir können euch im Gästezimmer unterbringen.","exEn":"We can put you up in the guest room.","why":"unter = under: you bring someone under a roof.","grade":"M","how":"pic","level":"B2","zipf":3.55,"board":true,"lemma":null,"lex":["dwds","corpus","wf"]},
 {"id":"die_Unterbringung","card":"PF:die_Unterbringung","word":"Unterbringung","cls":"noun","art":"die","parent":"unterbringen.verb","add":"ung","side":"suf","pre":["unter"],"suf":["ung"],"key":"unter|ung","seg":[["p","Unter"],["r","bring"],["s","ung"]],"stress":0,"en":"accommodation (housing people)","clue":"the accommodation (housing people)","ex":"Die Stadt kümmert sich um die Unterbringung der Flüchtlinge.","exEn":"The city is taking care of housing the refugees.","grade":"T","how":"lit","level":"C1","zipf":3.83,"board":true,"lemma":null,"lex":["dwds","corpus","wf"]},
 {"id":"vorbringen.verb","card":"PF:vorbringen.verb","word":"vorbringen","cls":"verb","kind":"s","aux":"hat","pp":"vorgebracht","parent":"bringen.verb","add":"vor","side":"pre","pre":["vor"],"suf":[],"key":"vor|","seg":[["p","vor"],["r","bring"],["i","en"]],"stress":1,"en":"put forward (an argument, a complaint)","clue":"to put forward (an argument)","ex":"Er hat in der Sitzung gute Argumente vorgebracht.","exEn":"He put forward good arguments in the meeting.","why":"vor = forward: you bring an argument forward.","grade":"T","how":"lit","level":"C1","zipf":3.2,"board":true,"lemma":null,"lex":["dwds","corpus","wf"]},
 {"id":"zurückbringen.verb","card":"PF:zurückbringen.verb","word":"zurückbringen","cls":"verb","kind":"s","aux":"hat","pp":"zurückgebracht","parent":"bringen.verb","add":"zurück","side":"pre","pre":["zurück"],"suf":[],"key":"zurück|","seg":[["p","zurück"],["r","bring"],["i","en"]],"stress":3,"en":"bring back, take back","clue":"to take back (books to the library)","ex":"Ich muss die Bücher in die Bibliothek zurückbringen.","exEn":"I have to take the books back to the library.","why":"zurück = back: you bring it back.","grade":"T","how":"lit","level":"A2","zipf":3.13,"board":true,"lemma":null,"lex":["dwds","corpus","wf"]},
 {"id":"wegbringen.verb","card":"PF:wegbringen.verb","word":"wegbringen","cls":"verb","kind":"s","aux":"hat","pp":"weggebracht","parent":"bringen.verb","add":"weg","side":"pre","pre":["weg"],"suf":[],"key":"weg|","seg":[["p","weg"],["r","bring"],["i","en"]],"stress":1,"en":"take away (somewhere)","clue":"to take away (the rubbish)","ex":"Bringst du bitte den Müll weg?","exEn":"Will you take the rubbish out, please?","why":"weg = away: you bring it away.","grade":"T","how":"lit","level":"B1","zipf":2.6,"board":true,"lemma":null,"lex":["dwds","corpus","wf"]},
 {"id":"herbringen.verb","card":"PF:herbringen.verb","word":"herbringen","cls":"verb","kind":"s","aux":"hat","pp":"hergebracht","parent":"bringen.verb","add":"her","side":"pre","pre":["her"],"suf":[],"key":"her|","seg":[["p","her"],["r","bring"],["i","en"]],"stress":1,"en":"bring here (to the speaker)","clue":"to bring over here (to me)","ex":"Kannst du mir die Tasche bitte herbringen?","exEn":"Can you bring me the bag, please?","why":"her = here, toward the speaker: you bring it to where I am.","grade":"T","how":"lit","level":"B1","zipf":1.93,"board":true,"lemma":null,"lex":["dwds","corpus","wf"]},